{
  "schema_version": "jurisdiction-inventory-v1",
  "as_of": "2026-05-12T22:07:19Z",
  "total_baselined": 20,
  "total_published": 14,
  "total_advennt_live": 20,
  "total_baseline_complete": 18,
  "by_status": {
    "published": 14,
    "baseline_in_progress": 2,
    "baseline_complete": 4,
    "stub": 55
  },
  "by_jid": {
    "AE": {
      "status": "stub",
      "in_advennt": false,
      "publication_gate": null
    },
    "AR": {
      "status": "stub",
      "in_advennt": false,
      "publication_gate": null
    },
    "AT": {
      "status": "stub",
      "in_advennt": false,
      "publication_gate": null
    },
    "AU": {
      "status": "baseline_complete",
      "in_advennt": true,
      "publication_gate": "schema_valid"
    },
    "BE": {
      "status": "stub",
      "in_advennt": false,
      "publication_gate": null
    },
    "BG": {
      "status": "stub",
      "in_advennt": false,
      "publication_gate": null
    },
    "BR": {
      "status": "stub",
      "in_advennt": false,
      "publication_gate": null
    },
    "CA": {
      "status": "stub",
      "in_advennt": false,
      "publication_gate": null
    },
    "CA-ON": {
      "status": "published",
      "in_advennt": true,
      "publication_gate": null
    },
    "CH": {
      "status": "stub",
      "in_advennt": false,
      "publication_gate": null
    },
    "CL": {
      "status": "stub",
      "in_advennt": false,
      "publication_gate": null
    },
    "CN": {
      "status": "baseline_complete",
      "in_advennt": true,
      "publication_gate": "schema_valid"
    },
    "CO": {
      "status": "published",
      "in_advennt": true,
      "publication_gate": null
    },
    "CR": {
      "status": "stub",
      "in_advennt": false,
      "publication_gate": null
    },
    "CW": {
      "status": "published",
      "in_advennt": true,
      "publication_gate": null
    },
    "CY": {
      "status": "published",
      "in_advennt": true,
      "publication_gate": null
    },
    "CZ": {
      "status": "stub",
      "in_advennt": false,
      "publication_gate": null
    },
    "DE": {
      "status": "stub",
      "in_advennt": false,
      "publication_gate": null
    },
    "DK": {
      "status": "published",
      "in_advennt": true,
      "publication_gate": null
    },
    "DO": {
      "status": "stub",
      "in_advennt": false,
      "publication_gate": null
    },
    "EC": {
      "status": "stub",
      "in_advennt": false,
      "publication_gate": null
    },
    "EE": {
      "status": "stub",
      "in_advennt": false,
      "publication_gate": null
    },
    "EG": {
      "status": "stub",
      "in_advennt": false,
      "publication_gate": null
    },
    "ES": {
      "status": "published",
      "in_advennt": true,
      "publication_gate": null
    },
    "FI": {
      "status": "stub",
      "in_advennt": false,
      "publication_gate": null
    },
    "FR": {
      "status": "stub",
      "in_advennt": false,
      "publication_gate": null
    },
    "GB": {
      "status": "baseline_complete",
      "in_advennt": true,
      "publication_gate": "schema_valid"
    },
    "GH": {
      "status": "stub",
      "in_advennt": false,
      "publication_gate": null
    },
    "GI": {
      "status": "published",
      "in_advennt": true,
      "publication_gate": null
    },
    "GR": {
      "status": "published",
      "in_advennt": true,
      "publication_gate": null
    },
    "HK": {
      "status": "stub",
      "in_advennt": false,
      "publication_gate": null
    },
    "HR": {
      "status": "stub",
      "in_advennt": false,
      "publication_gate": null
    },
    "HU": {
      "status": "stub",
      "in_advennt": false,
      "publication_gate": null
    },
    "IE": {
      "status": "stub",
      "in_advennt": false,
      "publication_gate": null
    },
    "IM": {
      "status": "published",
      "in_advennt": true,
      "publication_gate": null
    },
    "IN": {
      "status": "stub",
      "in_advennt": false,
      "publication_gate": null
    },
    "IS": {
      "status": "stub",
      "in_advennt": false,
      "publication_gate": null
    },
    "IT": {
      "status": "stub",
      "in_advennt": false,
      "publication_gate": null
    },
    "JP": {
      "status": "stub",
      "in_advennt": false,
      "publication_gate": null
    },
    "KE": {
      "status": "stub",
      "in_advennt": false,
      "publication_gate": null
    },
    "KH": {
      "status": "stub",
      "in_advennt": false,
      "publication_gate": null
    },
    "LK": {
      "status": "stub",
      "in_advennt": false,
      "publication_gate": null
    },
    "LT": {
      "status": "stub",
      "in_advennt": false,
      "publication_gate": null
    },
    "LV": {
      "status": "stub",
      "in_advennt": false,
      "publication_gate": null
    },
    "MA": {
      "status": "stub",
      "in_advennt": false,
      "publication_gate": null
    },
    "MO": {
      "status": "stub",
      "in_advennt": false,
      "publication_gate": null
    },
    "MT": {
      "status": "published",
      "in_advennt": true,
      "publication_gate": null
    },
    "MX": {
      "status": "stub",
      "in_advennt": false,
      "publication_gate": null
    },
    "MY": {
      "status": "stub",
      "in_advennt": false,
      "publication_gate": null
    },
    "MZ": {
      "status": "stub",
      "in_advennt": false,
      "publication_gate": null
    },
    "NG": {
      "status": "stub",
      "in_advennt": false,
      "publication_gate": null
    },
    "NL": {
      "status": "published",
      "in_advennt": true,
      "publication_gate": null
    },
    "NO": {
      "status": "stub",
      "in_advennt": false,
      "publication_gate": null
    },
    "NZ": {
      "status": "baseline_in_progress",
      "in_advennt": true,
      "publication_gate": null
    },
    "PA": {
      "status": "stub",
      "in_advennt": false,
      "publication_gate": null
    },
    "PE": {
      "status": "stub",
      "in_advennt": false,
      "publication_gate": null
    },
    "PH": {
      "status": "published",
      "in_advennt": true,
      "publication_gate": null
    },
    "PL": {
      "status": "stub",
      "in_advennt": false,
      "publication_gate": null
    },
    "PT": {
      "status": "stub",
      "in_advennt": false,
      "publication_gate": null
    },
    "RO": {
      "status": "published",
      "in_advennt": true,
      "publication_gate": null
    },
    "RS": {
      "status": "stub",
      "in_advennt": false,
      "publication_gate": null
    },
    "RU": {
      "status": "stub",
      "in_advennt": false,
      "publication_gate": null
    },
    "SE": {
      "status": "published",
      "in_advennt": true,
      "publication_gate": null
    },
    "SG": {
      "status": "stub",
      "in_advennt": false,
      "publication_gate": null
    },
    "SK": {
      "status": "stub",
      "in_advennt": false,
      "publication_gate": null
    },
    "TN": {
      "status": "stub",
      "in_advennt": false,
      "publication_gate": null
    },
    "TOBIQUE": {
      "status": "stub",
      "in_advennt": false,
      "publication_gate": null
    },
    "TW": {
      "status": "baseline_in_progress",
      "in_advennt": true,
      "publication_gate": null
    },
    "TZ": {
      "status": "stub",
      "in_advennt": false,
      "publication_gate": null
    },
    "UA": {
      "status": "stub",
      "in_advennt": false,
      "publication_gate": null
    },
    "UG": {
      "status": "stub",
      "in_advennt": false,
      "publication_gate": null
    },
    "US": {
      "status": "baseline_complete",
      "in_advennt": true,
      "publication_gate": "schema_valid"
    },
    "UY": {
      "status": "stub",
      "in_advennt": false,
      "publication_gate": null
    },
    "ZA": {
      "status": "stub",
      "in_advennt": false,
      "publication_gate": null
    },
    "ZM": {
      "status": "stub",
      "in_advennt": false,
      "publication_gate": null
    }
  },
  "warnings": [
    "NZ: unrecognised pipeline_stage='stub' \u2014 classifying as baseline_in_progress",
    "TW: unrecognised pipeline_stage='stub' \u2014 classifying as baseline_in_progress"
  ]
}
